{
  "Products": [],
  "NextInvoiceAmount": 12.5,
  "NextInvoiceBillingDate": "2026-06-02T12:00:00Z",
  "UpcomingInvoiceItems": [],
  "UpcomingInvoiceDiscounts": [],
  "UpcomingInvoice": "string",
  "SubscriptionId": "500123",
  "Name": "Example Name",
  "Status": "Incomplete",
  "Currency": "EUR",
  "User": "string",
  "DefaultPaymentDescription": "string",
  "CancellationRequestDate": "2026-06-02T12:00:00Z",
  "CancellationDate": "2026-06-02T12:00:00Z"
}